{
  "decision": "accept",
  "reasoning_summary": "The protocol text describes a simple sequence of actions involving a sample tube, buffer addition, mixing, and storage. It has been parsed into six distinct steps with clear actions, entities (targets like fridge and tube), and parameters (volume, mixing repetitions).",
  "parsed_protocol": {
    "protocol_id": "protocol_1",
    "steps": [
      {
        "step_id": "s1",
        "raw_text": "Open the fridge",
        "action": "open",
        "entities": {
          "target": "fridge"
        },
        "parameters": {}
      },
      {
        "step_id": "s2",
        "raw_text": "take the sample tube",
        "action": "take",
        "entities": {
          "target": "sample tube"
        },
        "parameters": {}
      },
      {
        "step_id": "s3",
        "raw_text": "add 100 uL buffer",
        "action": "add",
        "entities": {
          "target": "sample tube"
        },
        "parameters": {
          "volume_ul": 100
        }
      },
      {
        "step_id": "s4",
        "raw_text": "mix 5 times",
        "action": "mix",
        "entities": {
          "target": "sample tube"
        },
        "parameters": {
          "repetitions": 5
        }
      },
      {
        "step_id": "s5",
        "raw_text": "cap it",
        "action": "cap",
        "entities": {
          "target": "sample tube"
        },
        "parameters": {}
      },
      {
        "step_id": "s6",
        "raw_text": "return it to the fridge",
        "action": "return",
        "entities": {
          "target": "fridge"
        },
        "parameters": {}
      }
    ]
  },
  "assumptions": []
}