{
  "decision": "accept",
  "reasoning_summary": "The protocol text describes a sequence of three clear actions: retrieving a sample tube, centrifuging it, and then performing an addition and incubation. Each step can be parsed into a distinct step with an action, relevant entities (like the sample tube as a target), and parameters (like volume, temperature, and duration).",
  "parsed_protocol": {
    "protocol_id": "parsed_protocol_1",
    "steps": [
      {
        "step_id": "s1",
        "raw_text": "Take sample tube from fridge.",
        "action": "take",
        "entities": {
          "target": "sample tube",
          "source": "fridge"
        },
        "parameters": {}
      },
      {
        "step_id": "s2",
        "raw_text": "Briefly centrifuge it,",
        "action": "centrifuge",
        "entities": {
          "target": "sample tube"
        },
        "parameters": {
          "duration_min": "brief"
        }
      },
      {
        "step_id": "s3",
        "raw_text": "then add 100 uL buffer and incubate at 37C for 10 min.",
        "action": "add_and_incubate",
        "entities": {
          "target": "sample tube"
        },
        "parameters": {
          "volume_ul": 100,
          "temperature_c": 37,
          "duration_min": 10
        }
      }
    ]
  },
  "assumptions": []
}