{
  "decision": "accept",
  "reasoning_summary": "The protocol text describes a clear sequence of three main actions: retrieving a sample, adding a reagent, and incubating. Each step can be parsed into distinct steps with identifiable actions, entities, and parameters.",
  "parsed_protocol": {
    "protocol_id": "parsed_protocol_1",
    "steps": [
      {
        "step_id": "s1",
        "raw_text": "Take the sample tube from the fridge",
        "action": "retrieve",
        "entities": {
          "target": "sample tube",
          "source": "fridge"
        },
        "parameters": {}
      },
      {
        "step_id": "s2",
        "raw_text": "add 100 uL buffer",
        "action": "add",
        "entities": {
          "target": "sample tube",
          "reagent": "buffer"
        },
        "parameters": {
          "volume_ul": 100
        }
      },
      {
        "step_id": "s3",
        "raw_text": "mix 5 times",
        "action": "mix",
        "entities": {
          "target": "sample tube"
        },
        "parameters": {
          "repetitions": 5
        }
      },
      {
        "step_id": "s4",
        "raw_text": "then incubate at 37C for 10 minutes",
        "action": "incubate",
        "entities": {
          "target": "sample tube"
        },
        "parameters": {
          "temperature_c": 37,
          "duration_min": 10
        }
      }
    ]
  },
  "assumptions": [
    "The 'sample tube' is the primary container throughout all steps, so it is mapped as the target entity where applicable.",
    "The 'fridge' in step 1 is interpreted as a source location entity.",
    "The 'buffer' in step 2 is interpreted as a reagent entity being added.",
    "Mixing '5 times' is interpreted as a repetitions parameter, as no specific volume or method (e.g., vortex, pipette) is specified.",
    "The incubation temperature '37C' and duration '10 minutes' are mapped to standard parameters."
  ]
}