{
  "decision": "accept",
  "reasoning_summary": "The protocol text describes three sequential steps: retrieving a sample tube, adding a specified volume of buffer to it, and mixing it a set number of times. Each step has been parsed into a structured step with appropriate action, entities, and parameters. Entities and parameters are mapped according to the specified rules (e.g., destination/tube to entities.target, volume to parameters.volume_ul, mixing repetitions to parameters.repetitions).",
  "parsed_protocol": {
    "protocol_id": "parsed_protocol_1",
    "steps": [
      {
        "step_id": "s1",
        "raw_text": "Take sample tube from fridge.",
        "action": "take",
        "entities": {
          "target": "sample tube",
          "source": "fridge"
        },
        "parameters": {}
      },
      {
        "step_id": "s2",
        "raw_text": "Add 100 uL buffer to sample tube.",
        "action": "add",
        "entities": {
          "target": "sample tube",
          "substance": "buffer"
        },
        "parameters": {
          "volume_ul": 100
        }
      },
      {
        "step_id": "s3",
        "raw_text": "Mix 5 times.",
        "action": "mix",
        "entities": {
          "target": "sample tube"
        },
        "parameters": {
          "repetitions": 5
        }
      }
    ]
  },
  "assumptions": []
}