{
  "decision": "accept",
  "reasoning_summary": "The protocol text describes a single, clear step involving adding a specified volume of buffer to a sample tube. It can be parsed into a structured step with action 'add', entities for the target (sample tube), and parameters for volume.",
  "parsed_protocol": {
    "protocol_id": "parsed_protocol_1",
    "steps": [
      {
        "step_id": "s1",
        "raw_text": "Add 100 uL buffer to the sample tube.",
        "action": "add",
        "entities": {
          "target": "sample tube"
        },
        "parameters": {
          "volume_ul": 100
        }
      }
    ]
  },
  "assumptions": []
}