{
  "decision": "accept",
  "reasoning_summary": "The protocol text describes a clear sequence of three actions: retrieving a sample tube, adding buffer and mixing, and incubating. Each step can be parsed into distinct step IDs with identifiable actions, entities, and parameters.",
  "parsed_protocol": {
    "protocol_id": "parsed_protocol_1",
    "steps": [
      {
        "step_id": "s1",
        "raw_text": "Take the sample tube from the fridge",
        "action": "retrieve",
        "entities": {
          "target": "sample tube",
          "source": "fridge"
        },
        "parameters": {}
      },
      {
        "step_id": "s2",
        "raw_text": "add 100 uL buffer and mix 5 times",
        "action": "add_and_mix",
        "entities": {
          "target": "sample tube"
        },
        "parameters": {
          "volume_ul": 100,
          "mix_cycles": 5
        }
      },
      {
        "step_id": "s3",
        "raw_text": "incubate at 37C for 10 minutes",
        "action": "incubate",
        "entities": {
          "target": "sample tube"
        },
        "parameters": {
          "temperature_c": 37,
          "duration_min": 10
        }
      }
    ]
  },
  "assumptions": []
}