{
  "decision": "accept",
  "reasoning_summary": "The protocol text describes a clear sequence of three main actions: retrieving a sample, adding a reagent, and incubating. Each step can be parsed into distinct steps with identifiable actions, entities, and parameters.",
  "parsed_protocol": {
    "protocol_id": "parsed_protocol_1",
    "steps": [
      {
        "step_id": "s1",
        "raw_text": "Take the sample tube from the fridge",
        "action": "retrieve",
        "entities": {
          "target": "sample tube",
          "source": "fridge"
        },
        "parameters": {}
      },
      {
        "step_id": "s2",
        "raw_text": "add 100 uL buffer",
        "action": "add",
        "entities": {
          "target": "sample tube"
        },
        "parameters": {
          "volume_ul": 100,
          "reagent": "buffer"
        }
      },
      {
        "step_id": "s3",
        "raw_text": "mix 5 times",
        "action": "mix",
        "entities": {
          "target": "sample tube"
        },
        "parameters": {
          "repetitions": 5
        }
      },
      {
        "step_id": "s4",
        "raw_text": "then incubate at 37C for 10 minutes",
        "action": "incubate",
        "entities": {
          "target": "sample tube"
        },
        "parameters": {
          "temperature_c": 37,
          "duration_min": 10
        }
      }
    ]
  },
  "assumptions": [
    "The 'sample tube' from step 1 is the same target for steps 2, 3, and 4.",
    "'mix 5 times' implies mixing the contents of the sample tube after adding buffer.",
    "The incubation in step 4 applies to the sample tube after mixing.",
    "Volume '100 uL' is interpreted as 100 microliters.",
    "Temperature '37C' is interpreted as 37 degrees Celsius.",
    "Duration '10 minutes' is interpreted as 10 minutes."
  ]
}