{
  "decision": "accept",
  "reasoning_summary": "The protocol text describes a clear sequence of four steps involving sample handling, reagent addition, mixing, and incubation. Each step can be parsed into a structured format with an action, relevant entities (like target containers or reagents), and parameters (like volume, count, temperature, and duration).",
  "parsed_protocol": {
    "protocol_id": "parsed_protocol_1",
    "steps": [
      {
        "step_id": "s1",
        "raw_text": "Retrieve the sample tube from fridge.",
        "action": "retrieve",
        "entities": {
          "target": "sample tube",
          "source": "fridge"
        },
        "parameters": {}
      },
      {
        "step_id": "s2",
        "raw_text": "Add 80 uL lysis buffer.",
        "action": "add",
        "entities": {
          "target": "sample tube",
          "reagent": "lysis buffer"
        },
        "parameters": {
          "volume_ul": 80
        }
      },
      {
        "step_id": "s3",
        "raw_text": "Vortex it 8 times.",
        "action": "vortex",
        "entities": {
          "target": "sample tube"
        },
        "parameters": {
          "count": 8
        }
      },
      {
        "step_id": "s4",
        "raw_text": "Warm it at 37C for 12 min.",
        "action": "incubate",
        "entities": {
          "target": "sample tube"
        },
        "parameters": {
          "temperature_c": 37,
          "duration_min": 12
        }
      }
    ]
  },
  "assumptions": []
}