{
  "decision": "accept",
  "reasoning_summary": "The protocol text describes a clear sequence of four steps: retrieving a sample, adding a reagent, mixing, and incubating. Each step can be parsed into a structured format with an action, relevant entities (like the target of the action), and parameters (like volume, count, temperature, and duration).",
  "parsed_protocol": {
    "protocol_id": "parsed_protocol_1",
    "steps": [
      {
        "step_id": "s1",
        "raw_text": "Take the sample tube from the fridge.",
        "action": "take",
        "entities": {
          "target": "sample tube",
          "source": "fridge"
        },
        "parameters": {}
      },
      {
        "step_id": "s2",
        "raw_text": "Add 120 uL buffer.",
        "action": "add",
        "entities": {
          "target": "sample tube"
        },
        "parameters": {
          "volume_ul": 120,
          "reagent": "buffer"
        }
      },
      {
        "step_id": "s3",
        "raw_text": "Mix 6 times.",
        "action": "mix",
        "entities": {
          "target": "sample tube"
        },
        "parameters": {
          "count": 6
        }
      },
      {
        "step_id": "s4",
        "raw_text": "Incubate at 37C for 15 minutes.",
        "action": "incubate",
        "entities": {
          "target": "sample tube"
        },
        "parameters": {
          "temperature_c": 37,
          "duration_min": 15
        }
      }
    ]
  },
  "assumptions": [
    "The 'sample tube' is the primary container for all steps after it is taken.",
    "The buffer is added to the sample tube.",
    "The mixing action is performed on the contents of the sample tube.",
    "The incubation is performed on the sample tube."
  ]
}