{
  "decision": "accept",
  "reasoning_summary": "The protocol text describes a simple sequence of actions involving a sample tube, buffer addition, mixing, and storage. It has been parsed into six distinct steps with clear actions, entities, and parameters where applicable. Assumptions were made to clarify implicit entities and standardize parameter units.",
  "parsed_protocol": {
    "protocol_id": "parsed_protocol_1",
    "steps": [
      {
        "step_id": "s1",
        "raw_text": "Open the fridge",
        "action": "open",
        "entities": {
          "target": "fridge"
        },
        "parameters": {}
      },
      {
        "step_id": "s2",
        "raw_text": "take the sample tube",
        "action": "take",
        "entities": {
          "target": "sample tube"
        },
        "parameters": {}
      },
      {
        "step_id": "s3",
        "raw_text": "add 100 uL buffer",
        "action": "add",
        "entities": {
          "target": "sample tube"
        },
        "parameters": {
          "volume_ul": 100,
          "reagent": "buffer"
        }
      },
      {
        "step_id": "s4",
        "raw_text": "mix 5 times",
        "action": "mix",
        "entities": {
          "target": "sample tube"
        },
        "parameters": {
          "repetitions": 5
        }
      },
      {
        "step_id": "s5",
        "raw_text": "cap it",
        "action": "cap",
        "entities": {
          "target": "sample tube"
        },
        "parameters": {}
      },
      {
        "step_id": "s6",
        "raw_text": "return it to the fridge",
        "action": "return",
        "entities": {
          "target": "fridge",
          "object": "sample tube"
        },
        "parameters": {}
      }
    ]
  },
  "assumptions": [
    "The 'sample tube' is the primary container throughout the protocol and is the target for actions like 'take', 'add', 'mix', and 'cap'.",
    "The 'buffer' in step s3 is a reagent, stored as a parameter.reagent, with volume standardized to microliters (uL).",
    "Step s4 'mix 5 times' implies mixing the sample tube's contents, with repetitions captured as a parameter.repetitions since no standard duration parameter applies.",
    "Step s6 'return it to the fridge' involves two entities: the 'sample tube' as the object being returned and the 'fridge' as the target destination."
  ]
}