{
  "decision": "accept",
  "reasoning_summary": "The protocol text describes a simple four-step procedure. Each step is clearly delineated and can be parsed into distinct actions with identifiable entities and parameters. The steps involve retrieving a sample, adding a reagent, mixing, and incubating. Entities like 'sample tube' and 'lysis buffer' are mapped, and parameters like volume, number of mixes, temperature, and duration are extracted.",
  "parsed_protocol": {
    "protocol_id": "parsed_protocol_1",
    "steps": [
      {
        "step_id": "s1",
        "raw_text": "Take the sample tube from the fridge.",
        "action": "take",
        "entities": {
          "target": "sample tube",
          "source": "fridge"
        },
        "parameters": {}
      },
      {
        "step_id": "s2",
        "raw_text": "Add 100 uL lysis buffer to the sample tube.",
        "action": "add",
        "entities": {
          "target": "sample tube",
          "reagent": "lysis buffer"
        },
        "parameters": {
          "volume_ul": 100
        }
      },
      {
        "step_id": "s3",
        "raw_text": "Mix 5 times.",
        "action": "mix",
        "entities": {
          "target": "sample tube"
        },
        "parameters": {
          "repetitions": 5
        }
      },
      {
        "step_id": "s4",
        "raw_text": "Incubate at 37C for 10 min.",
        "action": "incubate",
        "entities": {
          "target": "sample tube"
        },
        "parameters": {
          "temperature_c": 37,
          "duration_min": 10
        }
      }
    ]
  },
  "assumptions": [
    "The 'sample tube' is the primary container for all steps after retrieval.",
    "Mixing in step s3 is assumed to be performed on the contents of the sample tube.",
    "Incubation in step s4 is assumed to be performed on the sample tube.",
    "The term 'fridge' in step s1 is interpreted as a storage location (source).",
    "The volume '100 uL' is interpreted as microliters and mapped to volume_ul.",
    "Temperature '37C' is interpreted as degrees Celsius and mapped to temperature_c.",
    "Duration '10 min' is interpreted as minutes and mapped to duration_min."
  ]
}