{
  "decision": "accept",
  "reasoning_summary": "The protocol text describes a single, clear step involving adding a specified volume of buffer to a sample tube. It can be parsed into one step with appropriate action, entities, and parameters.",
  "parsed_protocol": {
    "protocol_id": "parsed_1",
    "steps": [
      {
        "step_id": "s1",
        "raw_text": "Add 0.1 mL buffer to the sample tube.",
        "action": "add",
        "entities": {
          "target": "sample tube"
        },
        "parameters": {
          "volume_ul": 100.0
        }
      }
    ]
  },
  "assumptions": []
}