{
  "decision": "accept",
  "reasoning_summary": "The protocol text describes a clear sequence of four steps: retrieving a tube, adding a volume of buffer, mixing, and incubating at a specified temperature and duration. Each step can be parsed into a structured step with an action, relevant entities (like the target container), and parameters (like volume, temperature, time).",
  "parsed_protocol": {
    "protocol_id": "parsed_protocol_1",
    "steps": [
      {
        "step_id": "s1",
        "raw_text": "Take the tube from the fridge.",
        "action": "take",
        "entities": {
          "target": "tube",
          "source": "fridge"
        },
        "parameters": {}
      },
      {
        "step_id": "s2",
        "raw_text": "Add 120 uL buffer.",
        "action": "add",
        "entities": {
          "target": "tube",
          "substance": "buffer"
        },
        "parameters": {
          "volume_ul": 120
        }
      },
      {
        "step_id": "s3",
        "raw_text": "Mix 6x.",
        "action": "mix",
        "entities": {
          "target": "tube"
        },
        "parameters": {
          "repetitions": 6
        }
      },
      {
        "step_id": "s4",
        "raw_text": "Incubate for 15 minutes at 37C.",
        "action": "incubate",
        "entities": {
          "target": "tube"
        },
        "parameters": {
          "duration_min": 15,
          "temperature_c": 37
        }
      }
    ]
  },
  "assumptions": [
    "The 'tube' referenced in steps 2-4 is the same tube taken from the fridge in step 1.",
    "'Mix 6x' implies mixing the contents of the tube 6 times, parsed as a repetitions parameter.",
    "'120 uL' is interpreted as 120 microliters for volume_ul.",
    "'37C' is interpreted as 37 degrees Celsius for temperature_c.",
    "'15 minutes' is interpreted as 15 minutes for duration_min."
  ]
}