{
  "decision": "accept",
  "reasoning_summary": "The protocol text describes a single incubation step with temperature and duration parameters.",
  "parsed_protocol": {
    "protocol_id": "parsed_protocol_1",
    "steps": [
      {
        "step_id": "s1",
        "raw_text": "Incubate at 37C for 10 minutes.",
        "action": "incubate",
        "entities": {},
        "parameters": {
          "temperature_c": 37,
          "duration_min": 10
        }
      }
    ]
  },
  "assumptions": []
}