{
  "decision": "accept",
  "reasoning_summary": "The protocol text describes a simple four-step procedure. Each step is clearly delineated and can be parsed into a structured step with an action, relevant entities, and parameters. The entities and parameters are mapped according to the specified conventions.",
  "parsed_protocol": {
    "protocol_id": "parsed_protocol_1",
    "steps": [
      {
        "step_id": "s1",
        "raw_text": "Take the sample tube from the fridge.",
        "action": "take",
        "entities": {
          "target": "sample tube",
          "source": "fridge"
        },
        "parameters": {}
      },
      {
        "step_id": "s2",
        "raw_text": "Add 100 uL lysis buffer to the sample tube.",
        "action": "add",
        "entities": {
          "target": "sample tube"
        },
        "parameters": {
          "volume_ul": 100,
          "reagent": "lysis buffer"
        }
      },
      {
        "step_id": "s3",
        "raw_text": "Mix 5 times.",
        "action": "mix",
        "entities": {
          "target": "sample tube"
        },
        "parameters": {
          "repetitions": 5
        }
      },
      {
        "step_id": "s4",
        "raw_text": "Incubate at 37C for 10 min.",
        "action": "incubate",
        "entities": {
          "target": "sample tube"
        },
        "parameters": {
          "temperature_c": 37,
          "duration_min": 10
        }
      }
    ]
  },
  "assumptions": [
    "The 'sample tube' is the primary container/target throughout all steps.",
    "The 'fridge' in step 1 is interpreted as a source entity.",
    "The 'lysis buffer' in step 2 is recorded as a reagent parameter.",
    "The mixing in step 3 is assumed to act upon the sample tube contents.",
    "The incubation in step 4 is assumed to act upon the sample tube contents."
  ]
}